{
	"type" : "object" ,
	"required" : true ,
	"$schema" : "http://json-schema.org/draft-03/schema" ,
	"properties" : {
		"users" : {
			"type" : "array" ,
			"required" : false ,
			"items" : 
				{
					"type" : "object" ,
					"properties" : {
						"id" : {
							"type" : "string" ,
							"required" : false
						} ,
						"name" : {
							"type" : "string" ,
							"required" : false
						} ,
						"email" : {
							"type" : "string" ,
							"required" : false
						} ,
						"time_zone" : {
							"type" : "string" ,
							"required" : false
						} ,
						"color" : {
							"type" : "string" ,
							"required" : false
						} ,
						"role" : {
							"type" : "string" ,
							"required" : false
						} ,
						"avatar_url" : {
							"type" : "string" ,
							"required" : false
						} ,
						"user_url" : {
							"type" : "string" ,
							"required" : false
						} ,
						"invitation_sent" : {
							"type" : "boolean" ,
							"required" : false
						}
					}
				}
			
		} ,
		"active_account_users" : {
			"type" : "number" ,
			"required" : false
		} ,
		"limit" : {
			"type" : "number" ,
			"required" : false
		} ,
		"query" : {
			"type" : "string" ,
			"required" : false
		} ,
		"offset" : {
			"type" : "number" ,
			"required" : false
		} ,
		"total" : {
			"type" : "number" ,
			"required" : false
		}
	}
}