{
	"users" : [ {
		"id" : "PP1565R" ,
		"name" : "John Smith" ,
		"email" : "john@example.com" ,
		"time_zone" : "Eastern Time (US & Canada)" ,
		"color" : "grey20" ,
		"role" : "user" ,
		"avatar_url" :
		"https://secure.gravatar.com/avatar/2e32280905f296791ed387cd0f61ec6b.png?d=mm&r=PG"
		,
		"user_url" : "/users/PP1565R" ,
		"invitation_sent" : true
	} ] ,
	"active_account_users" : 1 ,
	"limit" : 25 ,
	"query" : "john" ,
	"offset" : 0 ,
	"total" : 1
}